{
  "$schema": "https://json-schema.org/draft/2020-12/schema",
  "$id": "https://github.com/egallmann/ste-spec/contracts/architecture-evidence.schema.json",
  "title": "ArchitectureEvidence",
  "type": "object",
  "additionalProperties": false,
  "required": ["version", "subjects", "bundle", "freshness"],
  "properties": {
    "version": {
      "const": "2"
    },
    "subjects": {
      "type": "array",
      "minItems": 1,
      "items": {
        "type": "object",
        "additionalProperties": false,
        "required": ["kind", "id", "effect"],
        "properties": {
          "kind": {
            "type": "string",
            "enum": [
              "adr_l",
              "adr_ps",
              "adr_pc",
              "requirement",
              "invariant",
              "rule",
              "system",
              "component"
            ]
          },
          "id": {
            "type": "string",
            "minLength": 1
          },
          "effect": {
            "type": "string",
            "enum": ["validates", "invalidates"]
          }
        }
      }
    },
    "bundle": {
      "type": "object",
      "additionalProperties": false,
      "required": ["status", "warnings", "errors"],
      "properties": {
        "status": {
          "type": "string",
          "enum": ["valid", "degraded", "invalid"]
        },
        "warnings": {
          "type": "array",
          "items": { "type": "string" }
        },
        "errors": {
          "type": "array",
          "items": { "type": "string" }
        },
        "manifest": {
          "type": "object",
          "additionalProperties": false,
          "properties": {
            "generatedDate": { "type": "string" }
          }
        },
        "index": {
          "type": "object",
          "additionalProperties": false,
          "properties": {
            "generatedAt": { "type": "string" }
          }
        }
      }
    },
    "freshness": {
      "type": "object",
      "additionalProperties": false,
      "required": ["status"],
      "properties": {
        "status": {
          "type": "string",
          "enum": ["current", "stale-unknown", "stale-confirmed"]
        },
        "lastReconciled": {
          "type": "string"
        }
      }
    }
  }
}
