{
  "version": "2",
  "subjects": [
    {
      "kind": "system",
      "id": "repo:example-system",
      "effect": "validates"
    }
  ],
  "bundle": {
    "status": "valid",
    "warnings": [],
    "errors": [],
    "index": {
      "generatedAt": "2026-03-20T02:37:04.000Z"
    }
  },
  "freshness": {
    "status": "current",
    "lastReconciled": "2026-03-20T02:37:04.000Z"
  }
}
